EVTDESC_WOL_2227_CONSORT;My [GetFromRelation] [From.GetFirstName] was almost abducted last night. The treacherous [FromFrom.GetBestName] attempted to 'rescue' her by climbing in through the window, but slipped and fell! When questioned, the concussed [FromFrom.GetFirstName] admitted that [FromFromFrom.GetTitledName] was behind this chivalrous idiocy.;Ma [GetFromRelation] [From.GetFirstName] a presque été enlevée la nuit dernière. [FromFrom.GetBestName], dans sa traîtrise, a tenté de la 'sauver' en grimpant à travers la fenêtre, mais n'est parvenu(e) qu'à tomber misérablement ! Une fois interrogé(e), [FromFrom.GetFirstName] a admis que [FromFromFrom.GetTitledName] se cachait derrière cette cascade aussi stupide que chevaleresque.;Meine [GetFromRelation] [From.GetFirstName] wurde gestern Nacht beinahe entführt. [FromFrom.GetBestName], Verrat im Herzen, versuchte, sie zu 'retten', indem er durch ihr Fenster stieg, aber er verlor den Halt und stürzte! Beim Verhör gestand [FromFrom.GetFirstName], durch eine Gehirnerschütterung angeschlagen, dass [FromFromFrom.GetTitledName] hinter dieser ritterlichen Idiotie steckte.;;Mi [GetFromRelation] [From.GetFirstName] casi fue secuestrado ayer por la noche. El/La traidor/a de [FromFrom.GetBestName] intentó 'rescatarla' trepando a través de la ventana, pero resbaló y cayó. Cuestionado, el conmocionado [FromFrom.GetFirstName] admitió que [FromFromFrom.GetTitledName] estaba detrás de esta idiotez caballerosa.;;;;;;;;;x
EVTOPTA_WOL_2227;The dungeon is not secure enough. Throw [From.GetFirstName] in the oubliette!;Le donjon n'est pas assez sûr. Jeter [From.GetFirstName] aux oubliettes !;Der Kerker ist nicht sicher genug. Werft [From.GetFirstName] in das Verließ!;;La mazmorra no es lo suficientemente segura. ¡Echa a [From.GetFirstName] un calabozo!;;;;;;;;;x
EVTOPTB_WOL_2227;Tighten security!;Renforcer la sécurité !;Die Sicherheitsmaßnahmen müssen verschärft werden!;;¡Refuerza la seguridad!;;;;;;;;;x
EVTDESC_WOL_2228;The [GetRootFromInsult] [From.GetTitledFirstNameNoRegnal] had me thrown me in the oubliette to make sure I don't escape!;L'espèce [GetRootFromInsultNounAdj] [From.GetTitledFirstNameNoRegnal] m'a jeté(e) aux oubliettes pour faire en sorte que je ne m'échappe jamais !;Die Pest soll sie holen! [From.GetTitledFirstNameNoRegnal] hat mich ins Verließ stecken lassen, damit ich keine Chance habe zu entkommen!;;¡[GetRootFromInsult] [From.GetTitledFirstNameNoRegnal] me hizo lanzar a un calabozo para asegurarse que no me escape!;;;;;;;;;x
EVTOPTA_WOL_2228;I will die here...;Je vais mourir ici...;Ich werde hier sterben...;;Moriré aquí...;;;;;;;;;x
EVTDESC_WOL_2229;Bad news... [FromFrom.GetBestName] failed to free [From.GetBestName] from [From.GetPossPronoun] captivity and was imprisoned [FromFrom.GetReflexivePronoun]!;Mauvaise nouvelle... [FromFrom.GetBestName] a échoué dans sa tentative de libération de [From.GetBestName], et gît maintenant dans la même prison !;Schlechte Neuigkeiten... [FromFrom.GetBestName] schaffte es nicht, [From.GetBestName] aus der Gefangenschaft zu befreien und wurde gefangengenommen !;;Malas noticias... ¡[FromFrom.GetBestName] no consiguió liberar a [From.GetBestName] de [From.GetPossPronoun] cautiverio y fue encarcelado [FromFrom.GetReflexivePronoun]!;;;;;;;;;x
EVTOPTA_WOL_2229;Damnation! Security will be too tight now.;Damnation ! La sécurité sera trop sévère après ceci.;Hölle und Verdammnis! Die Sicherheitsmaßnahmen werden furchtbar sein.;;¡Maldita sea! Ahora la seguridad estará demasiado reforzada.;;;;;;;;;x
EVTDESC_WOL_2300;I watched from the shadows as my spymaster, [Root.job_spymaster.GetTitledFirstNameNoRegnal], surreptitiously marked a spot on the wall with a piece of chalk. This might just be [Root.job_spymaster.GetPossPronoun] normal skulduggery, but my intuition says not...;J'observais depuis les ombres alors que mon maître-espion, [Root.job_spymaster.GetTitledFirstNameNoRegnal], marquait furtivement un endroit sur le mur avec un morceau de craie. Il pourrait s'agir d'une de ses magouilles habituelles, mais mon instinct me dit le contraire...;Ich habe aus dem Verborgenen beobachtet, wie mein Meisterspion, [Root.job_spymaster.GetTitledFirstNameNoRegnal], verstohlen eine Stelle an der Wand mit Kreide markiert. Dies könnte einfach nur eine hinterhältige Gewohnheit sein, aber mein Bauchgefühl sagt mir etwas anderes...;;Vi desde las sombras como mi jefe de espías, [Root.job_spymaster.GetTitledFirstNameNoRegnal], marcaba subrepticiamente un punto en la pared con un trozo de tiza. Esto podría ser sólo uno de [Root.job_spymaster.GetPossPronoun] tejemanejes normales, pero mi intuición dice que no..;;;;;;;;;x
EVTOPTA_WOL_2300;Time to spy on the spy;Il est temps d'espionner l'espion;Höchste Zeit, dem Spion nachzuspionieren;;Tiempo de espiar al espía;;;;;;;;;x
EVTDESC_WOL_2302;Eavesdropping from a secret passage in the walls, I overheard my faithless spymaster [Root.job_spymaster.GetFirstName] talking to another conspirator. They are plotting to [From.GetPlot]!;Écoutant depuis un passage secret à l'intérieur des murs, j'entends mon maître-espion [Root.job_spymaster.GetFirstName] discuter avec un autre conspirateur. Ils prévoient de [From.GetPlot] !;Ich versteckte mich in einem geheimen Gang in der Wand und belauschte, wie mein treuloser Meisterspion [Root.job_spymaster.GetFirstName] mit einem anderen Verschwörer sprach. Sie haben folgenden Plan ausgeheckt: [From.GetPlot]!;;Escuchando desde un pasaje secreto dentro de las paredes, oí a mi desleal jefe de espías, [Root.job_spymaster.GetFirstName] hablando con otro conspirador. ¡Planean [From.GetPlot]!;;;;;;;;;x
EVTOPTA_WOL_2302;Arrest [Root.job_spymaster.GetTitledFirstNameNoRegnal] immediately!;Arrêter [Root.job_spymaster.GetTitledFirstNameNoRegnal] immédiatement !;Nehmt [Root.job_spymaster.GetTitledFirstNameNoRegnal] sofort fest!;;¡Detén a [Root.job_spymaster.GetTitledFirstNameNoRegnal] inmediatamente!;;;;;;;;;x
EVTOPTB_WOL_2302;Hold off. I will deal with this later.;Patience. Je m'occuperai de cela plus tard.;Immer mit der Ruhe. Ich beschäftige mich später damit.;;Espera. Me encargaré de esto más adelante.;;;;;;;;;x
EVTDESC_WOL_2303;My snooping [GetFromRelation], [From.GetTitledFirstName], apparently overheard me plotting murder and did not take kindly to my plans. I have been arrested!;Mon/ma [GetFromRelation], [From.GetTitledFirstName], a sournoisement écouté l'une de mes conversations traitant du complot meurtrier que je préparais depuis si longtemps, et cela ne lui a pas plu. Je viens d'être arrêté(e) !;[GetFromRelation] [From.GetTitledFirstName], neugierig wie immer, hat mich wohl belauscht, wie ich Mordtaten plante, und war nicht von meinen Plänen begeistert. Ich wurde festgenommen!;;El fisgón de mi [GetFromRelation], [From.GetTitledFirstName], por lo visto me oyó conspirar un asesinato y no se tomó bien mis planes. ¡Me ha detenido!;;;;;;;;;x
EVTDESC_WOL_2304;Over the last week, I have observed my spymaster [Root.job_spymaster.GetFirstName] carefully and found nothing further to arouse my suspicion. Perhaps I'll just have to accept that odd behavior goes with the job...;Depuis la semaine dernière, j'observe attentivement mon maître-espion [Root.job_spymaster.GetFirstName], sans jamais rien trouver de suspect. Peut-être devrais-je accepter que son comportement étrange n'est qu'une partie intégrante de son travail...;Im Laufe der letzten Woche habe ich meinen Meisterspion [Root.job_spymaster.GetFirstName] genau beobachtet, doch mein Verdacht wurde durch nichts bestätigt. Vielleicht sollte ich einfach akzeptieren, dass Menschen in dieser Branche ein seltsames Verhalten an den Tag legen...;;La semana pasada, he observado cuidadosamente jefe de espías, [Root.job_spymaster.GetFirstName], y no he encontrado encontraron nada que más que suscite mis sospechas. Quizás tendré que reconocer que el comportamiento raro va con el trabajo...;;;;;;;;;x
EVTOPTA_WOL_2304;I have more important things to do;J'ai d'autres choses à faire;Ich habe Wichtigeres zu tun;;Tengo cosas más importantes que hacer;;;;;;;;;x
EVTOPTB_WOL_2304;I can't take any chances. Have [Root.job_spymaster.GetObjectPronoun] replaced.;Je ne peux prendre aucun risque. Un remplacement est nécessaire.;Ich kann kein Risiko eingehen. [Root.job_spymaster.GetObjectPronoun] muss ersetzt werden.;;No puedo correr ningún riesgo. Que [Root.job_spymaster.GetObjectPronoun] sea reemplazado.;;;;;;;;;x
EVTDESC_WOL_2305;I have noticed my [GetFromRelation] [From.GetTitledFirstName] clumsily spying on me lately. It probably has something to do with [From.GetPossPronoun] unhealthy obsession with intrigue and an overly suspicious mind. I should be careful.;Ces derniers temps, j'ai remarqué que mon/ma [GetFromRelation] [From.GetTitledFirstName] m'espionnait sans trop de discrétion. Cela est sûrement connecté à son obsession bizarre avec les intrigues, et à sa nature suspicieuse en général. Je devrais faire attention.;Ich habe bemerkt, wie [GetFromRelation] [From.GetTitledFirstName] mir seit Kurzem tollpatschig nachspioniert. Wahrscheinlich hat dies etwas mit einer paranoiden Fixiertheit auf Intrigen und einem allzu argwöhnischen Geist zu tun. Ich sollte vorsichtig sein.;;He notado mi [GetFromRelation] [From.GetTitledFirstName] últimamente intenta espiarme. Probablemente tenga algo que ver con [From.GetPossPronoun] obsesión enfermiza con intriga y una mente más que desconfiada. Deberé tener cuidado.;;;;;;;;;x
EVTOPTA_WOL_2305;Lead [From.GetObjectPronoun] a merry chase!;Lui donner la pourchasse de sa vie !;Lasst [From.GetObjectPronoun] ins Leere laufen!;;¡Embárca[From.GetObjectPronoun] en una persecución interesante!;;;;;;;;;x
EVTOPTA_WOL_2100_3;Midgets, shoes... No! [target_spy_on.GetFirstName] is having an affair with a feisty goat!;Des nains, des chaussures... Oh non! [target_spy_on.GetFirstName] entretient une liaison avec une chèvre fougueuse !;Zwerge, Schuhe... Nein! [target_spy_on.GetFirstName] hat eine Affäre mit einer widerborstigen Ziege!;;Enanos, zapatos... No! [target_spy_on.GetFirstName] está teniendo relaciones con una cabra!;;;;;;;;;x;
EVTOPTA_WOL_2100_5;[target_spy_on.GetSubjectPronounCap] murdered a childhood friend at the tender age of 11!;[target_spy_on.GetSubjectPronounCap] a assassiné un ami d'enfance à l'âge de 11 ans !;[target_spy_on.GetSubjectPronounCap] ermordete einen Spielgefährten im zarten Alter von 11 Jahren!;;[target_spy_on.GetSubjectPronounCap] asesinó an un amiguito cuando tenía 11 años!;;;;;;;;;x;
EVTOPTA_WOL_2100_6;[target_spy_on.GetSubjectPronounCap] has an imaginary friend called Bappo!;[target_spy_on.GetSubjectPronounCap] possède un ami imaginaire appelé Bappo !;[target_spy_on.GetSubjectPronounCap] hat einen unsichtbaren Freund namens Bappo!;;[target_spy_on.GetSubjectPronounCap] tiene un amigo imaginario llamado Bápo!;;;;;;;;;x;
EVTOPTA_WOL_2100_8;[target_spy_on.GetSubjectPronounCap] leads a secret life as a prostitute in a brothel in [target_spy_on.Capital.Capital.GetName]!;[target_spy_on.GetSubjectPronounCap] se prostitue secrètement dans un bordel de [target_spy_on.Capital.Capital.GetName] !;[target_spy_on.GetSubjectPronounCap] führt ein Doppelleben als Prostituierte/r in einem Freudenhaus in [target_spy_on.Capital.Capital.GetName]!;;[target_spy_on.GetSubjectPronounCap] lleva una vida secreta como prostituta en un burdel en [target_spy_on.Capital.Capital.GetName]!;;;;;;;;;x;
EVTOPTB_WOL_2300;No, I can trust [intrigue_spymaster.GetObjectPronoun];Non, je peux avoir confance en [intrigue_spymaster.GetObjectPronoun];Nein, ich kann [intrigue_spymaster.GetObjectPronoun] vertrauen;;No, yo puedo fiarme de [intrigue_spymaster.GetObjectPronoun];;;;;;;;;x;
EVTOPTB_WOL_2071;Aha! Now I can call off my spies.;Ah ha ! Je peux maintenant rappeler mes espions.;Ach so! Nun kann ich meine Spione zurückpfeifen.;;Ah! Ahora puedo retirar mis espías.;;;;;;;;;x;
EVTOPTF_WOL_2080;I see, but I think it is time to spy on someone else.;Je vois... Il est temps d'espionner quelqu'un d'autre.;Verstehe, aber ich glaube, dass es an der Zeit ist, meine Spione auf jemand anderen anzusetzen.;;Muy bien, pero creo que ahora es el momento de espiar a otra persona.;;;;;;;;;x;
EVTOPTC_WOL_2100;No... I think it is time to spy on someone else.;Non... Je pense qu'il est temps d'espionner quelqu'un d'autre.;Nein... ich glaube, dass es an der Zeit ist, meine Spione auf jemand anderen anzusetzen.;;No... creo que ahora toca espiar a otra persona.;;;;;;;;;x;
EVTDESC_WOL_2065;I am not having much luck spying on [FromFromFrom.GetTitledFirstName]. Perhaps I should focus my efforts elsewhere?;Espionner [FromFromFrom.GetTitledFirstName] ne donne pas grand-chose. Peut-être devrais-je trouver une autre cible ?;Das Ausspionieren von [FromFromFrom.GetTitledFirstName] hat nicht viel gebracht. Vielleicht sollte ich meine Anstrengungen auf ein anderes Ziel ausrichten?;;No estoy teniendo mucha suerte espiando a [FromFromFrom.GetTitledFirstName]. Quizás debo poner mis esfuerzos en otro lado?;;;;;;;;;x;
EVTOPTA_WOL_2065;Yes, this is pointless.;Oui, c'est une perte de temps.;Ja, denn das hat keinen Sinn.;;Sí, esto no tiene sentido.;;;;;;;;;x;
EVTOPTB_WOL_2065;No, I am sure [FromFromFrom.GetSubjectPronoun] is up to something...;Non, je sais qu'[FromFromFrom.GetSubjectPronoun] cache quelque chose...;Nein, ich bin mir sicher, dass [FromFromFrom.GetSubjectPronoun] etwas im Schilde führt...;;No, estoy seguro de que [FromFromFrom.GetSubjectPronoun] está haciendo algo ilícito...;;;;;;;;;x;
